{
  "name": "Neon Melancholy",
  "summary": "A concise reusable visual style summary.",
  "tags": ["cinematic", "neon", "lonely"],
  "source_references": [
    {
      "image_path": "/absolute/path/to/reference.png",
      "source_prompt": "optional original image-generation prompt",
      "user_note": "optional user note",
      "role": "positive_reference"
    }
  ],
  "style_profile": {
    "art_style": "",
    "color_palette": [],
    "lighting": "",
    "composition": "",
    "mood": [],
    "camera_language": "",
    "materials": [],
    "era": "",
    "line_and_shape": "",
    "detail_density": "",
    "post_processing": "",
    "visual_keywords": [],
    "negative_traits": []
  },
  "prompt_template": "{source_prompt}, {style_summary}, {style_profile}",
  "negative_prompt": "",
  "status": "draft",
  "parent_style_id": null,
  "merged_into_style_id": null
}

